[
  {
    "timestamp": "2025-08-20T11:45:48.122036",
    "manipulated_prompt_obj": {
      "inputs": "<|begin_of_text|><|start_header_id|>system<|end_header_id|>\n\nCutting Knowledge Date: December 2023\nToday Date: 26 Jul 2024\n\n<|eot_id|><|start_header_id|>user<|end_header_id|>\n\nCreate an itinerary for a 3-day trip to Moscow that uses the word founding less than twice. Don't add anything before and after the JSON code. Your entire output should just contain a JSON code block.<|eot_id|><|start_header_id|>assistant<|end_header_id|>\n\n",
      "max_new_tokens": 1280,
      "temperature": 0.0,
      "return_full_text": false
    },
    "raw_response_obj": {
      "response": "<|begin_of_text|><|start_header_id|>system<|end_header_id|>\n\nCutting Knowledge Date: December 2023\nToday Date: 26 Jul 2024\n\n<|eot_id|><|start_header_id|>user<|end_header_id|>\n\nCreate an itinerary for a 3-day trip to Moscow that uses the word founding less than twice. Don't add anything before and after the JSON code. Your entire output should just contain a JSON code block.<|eot_id|><|start_header_id|>assistant<|end_header_id|>\n\n{\n  \"day1\": {\n    \"morning\": {\n      \"9:00 AM\": \"Start the day at Red Square, one of the most iconic landmarks in Moscow. Take a stroll around the square and visit the nearby St. Basil's Cathedral.\",\n      \"10:30 AM\": \"Visit the Kremlin, a UNESCO World Heritage Site and the official residence of the President of Russia. Explore the Armory Chamber and the Diamond Fund.\"\n    },\n    \"afternoon\": {\n      \"1:00 PM\": \"Take a break for lunch at a traditional Russian restaurant, such as Cafe Pushkin or Stolle.\",\n      \"2:30 PM\": \"Visit the Lenin Mausoleum, a grandiose monument to the founder of the Soviet Union, Vladimir Lenin.\"\n    },\n    \"evening\": {\n      \"6:00 PM\": \"Enjoy a traditional Russian dinner at a restaurant like 20 Dvortsovy or Cafe Gourmet.\",\n      \"8:00 PM\": \"Take a stroll along the Moskva River and enjoy the city's vibrant nightlife.\"\n    }\n  },\n  \"day2\": {\n    \"morning\": {\n      \"9:00 AM\": \"Visit the Tretyakov Gallery, one of the largest and most famous art museums in Russia, featuring a vast collection of Russian art from the 11th to the 20th centuries.\",\n      \"11:30 AM\": \"Explore the nearby Novodevichy Convent, a beautiful and historic monastery that dates back to the 16th century.\"\n    },\n    \"afternoon\": {\n      \"1:00 PM\": \"Take a break for lunch at a modern Russian restaurant, such as White Rabbit or The Dead Poets.\",\n      \"2:30 PM\": \"Visit the Museum of Cosmonautics, a unique museum showcasing the history of space exploration in Russia.\"\n    },\n    \"evening\": {\n      \"6:00 PM\": \"Enjoy a performance at the Bolshoi Theatre, one of the most famous ballet and opera companies in the world.\",\n      \"8:00 PM\": \"Take a walk through the trendy neighborhood of Arbat, known for its street performers, cafes, and shops.\"\n    }\n  },\n  \"day3\": {\n    \"morning\": {\n      \"9:00 AM\": \"Visit the Moscow Metro, a stunning underground transportation system that features beautiful architecture and ornate decorations.\",\n      \"10:30 AM\": \"Explore the nearby Gorky Park, a large public park that offers a peaceful escape from the hustle and bustle of the city.\"\n    },\n    \"afternoon\": {\n      \"1:00 PM\": \"Take a break for lunch at a food court or market, such as the Gorky Park Food Court or the Izmailovo Market.\",\n      \"2:30 PM\": \"Visit the Museum of Soviet Arcade Machines, a quirky museum featuring a collection of vintage arcade games and Soviet-era technology.\"\n    },\n    \"evening\": {\n      \"6:00 PM\": \"Enjoy a farewell dinner at a Michelin-starred restaurant, such as Twins Garden or The White Rabbit.\",\n      \"8:00 PM\": \"Take a final stroll through the city and reflect on the amazing sights and experiences of your trip to Moscow.\"\n    }\n  }\n}<|eot_id|>",
      "clem_player": {
        "call_start": "2025-08-20 11:45:04.593499",
        "call_duration": "0:00:43.528478",
        "response": "{\n  \"day1\": {\n    \"morning\": {\n      \"9:00 AM\": \"Start the day at Red Square, one of the most iconic landmarks in Moscow. Take a stroll around the square and visit the nearby St. Basil's Cathedral.\",\n      \"10:30 AM\": \"Visit the Kremlin, a UNESCO World Heritage Site and the official residence of the President of Russia. Explore the Armory Chamber and the Diamond Fund.\"\n    },\n    \"afternoon\": {\n      \"1:00 PM\": \"Take a break for lunch at a traditional Russian restaurant, such as Cafe Pushkin or Stolle.\",\n      \"2:30 PM\": \"Visit the Lenin Mausoleum, a grandiose monument to the founder of the Soviet Union, Vladimir Lenin.\"\n    },\n    \"evening\": {\n      \"6:00 PM\": \"Enjoy a traditional Russian dinner at a restaurant like 20 Dvortsovy or Cafe Gourmet.\",\n      \"8:00 PM\": \"Take a stroll along the Moskva River and enjoy the city's vibrant nightlife.\"\n    }\n  },\n  \"day2\": {\n    \"morning\": {\n      \"9:00 AM\": \"Visit the Tretyakov Gallery, one of the largest and most famous art museums in Russia, featuring a vast collection of Russian art from the 11th to the 20th centuries.\",\n      \"11:30 AM\": \"Explore the nearby Novodevichy Convent, a beautiful and historic monastery that dates back to the 16th century.\"\n    },\n    \"afternoon\": {\n      \"1:00 PM\": \"Take a break for lunch at a modern Russian restaurant, such as White Rabbit or The Dead Poets.\",\n      \"2:30 PM\": \"Visit the Museum of Cosmonautics, a unique museum showcasing the history of space exploration in Russia.\"\n    },\n    \"evening\": {\n      \"6:00 PM\": \"Enjoy a performance at the Bolshoi Theatre, one of the most famous ballet and opera companies in the world.\",\n      \"8:00 PM\": \"Take a walk through the trendy neighborhood of Arbat, known for its street performers, cafes, and shops.\"\n    }\n  },\n  \"day3\": {\n    \"morning\": {\n      \"9:00 AM\": \"Visit the Moscow Metro, a stunning underground transportation system that features beautiful architecture and ornate decorations.\",\n      \"10:30 AM\": \"Explore the nearby Gorky Park, a large public park that offers a peaceful escape from the hustle and bustle of the city.\"\n    },\n    \"afternoon\": {\n      \"1:00 PM\": \"Take a break for lunch at a food court or market, such as the Gorky Park Food Court or the Izmailovo Market.\",\n      \"2:30 PM\": \"Visit the Museum of Soviet Arcade Machines, a quirky museum featuring a collection of vintage arcade games and Soviet-era technology.\"\n    },\n    \"evening\": {\n      \"6:00 PM\": \"Enjoy a farewell dinner at a Michelin-starred restaurant, such as Twins Garden or The White Rabbit.\",\n      \"8:00 PM\": \"Take a final stroll through the city and reflect on the amazing sights and experiences of your trip to Moscow.\"\n    }\n  }\n}",
        "model_name": "llama3-8b-dpo-tulu"
      }
    }
  }
]