[
  {
    "timestamp": "2025-07-15T01:55:39.683193",
    "manipulated_prompt_obj": {
      "inputs": "<|begin_of_text|><|start_header_id|>system<|end_header_id|>\n\nCutting Knowledge Date: December 2023\nToday Date: 26 Jul 2024\n\n<|eot_id|><|start_header_id|>user<|end_header_id|>\n\nCreate an itinerary for a 3-day trip to Moscow that uses the word founding less than twice. Don't add anything before and after the JSON code. Your entire output should just contain a JSON code block.<|eot_id|><|start_header_id|>assistant<|end_header_id|>\n\n",
      "max_new_tokens": 1280,
      "temperature": 0.0,
      "return_full_text": false
    },
    "raw_response_obj": {
      "response": "<|begin_of_text|><|start_header_id|>system<|end_header_id|>\n\nCutting Knowledge Date: December 2023\nToday Date: 26 Jul 2024\n\n<|eot_id|><|start_header_id|>user<|end_header_id|>\n\nCreate an itinerary for a 3-day trip to Moscow that uses the word founding less than twice. Don't add anything before and after the JSON code. Your entire output should just contain a JSON code block.<|eot_id|><|start_header_id|>assistant<|end_header_id|>\n\n{\n  \"Day 1\": {\n    \"Morning\": {\n      \"9:00 AM\": \"Start the day at Red Square, one of the most iconic landmarks in Moscow. Explore the colorful St. Basil's Cathedral and take a stroll around the square.\",\n      \"10:30 AM\": \"Visit the nearby Kremlin, a UNESCO World Heritage Site and the former residence of Russian tsars. Take a guided tour of the Armory Chamber and the Diamond Fund.\"\n    },\n    \"Afternoon\": {\n      \"1:00 PM\": \"Take a break for lunch at a traditional Russian restaurant, such as Cafe Pushkin or Stolovaya No. 57.\",\n      \"2:30 PM\": \"Visit the Tretyakov Gallery, one of the largest and most famous art museums in Russia. The gallery features a vast collection of Russian art, including works by Kandinsky, Chagall, and Malevich.\"\n    },\n    \"Evening\": {\n      \"7:00 PM\": \"Enjoy a traditional Russian dinner at a restaurant like Cafe Krasny Oktyabr or Zima.\",\n      \"9:00 PM\": \"Take a stroll along the Moskva River and enjoy the city's nightlife.\"\n    }\n  },\n  \"Day 2\": {\n    \"Morning\": {\n      \"9:00 AM\": \"Visit the Novodevichy Convent, a beautiful 16th-century monastery that served as a prison for Russian aristocrats during the Soviet era.\",\n      \"11:00 AM\": \"Explore the nearby Museum of Modern Art, which features a collection of contemporary Russian art.\"\n    },\n    \"Afternoon\": {\n      \"1:00 PM\": \"Take a break for lunch at a modern Russian restaurant, such as White Rabbit or 50 Let Pobedy.\",\n      \"2:30 PM\": \"Visit the Bolshoi Theatre, one of the most famous opera and ballet companies in the world. Take a guided tour of the theatre and learn about its history and architecture.\"\n    },\n    \"Evening\": {\n      \"7:00 PM\": \"Enjoy a performance at the Bolshoi Theatre, if schedules permit.\",\n      \"9:00 PM\": \"Take a walk through the trendy neighborhood of Taganka, known for its street art and nightlife.\"\n    }\n  },\n  \"Day 3\": {\n    \"Morning\": {\n      \"9:00 AM\": \"Visit the Gorky Park, a large public park that offers a variety of activities, including boat rides, cycling, and picnicking.\",\n      \"11:00 AM\": \"Explore the nearby Museum of Cosmonautics, which features a collection of space-related artifacts and exhibits.\"\n    },\n    \"Afternoon\": {\n      \"1:00 PM\": \"Take a break for lunch at a park cafe or food truck.\",\n      \"2:30 PM\": \"Visit the Sparrow Hills, a scenic area with stunning views of the city. Take a walk along the observation deck and enjoy the views.\"\n    },\n    \"Evening\": {\n      \"6:00 PM\": \"Return to Red Square for a farewell dinner at a traditional Russian restaurant.\",\n      \"8:00 PM\": \"End the trip with a visit to the nearby Lenin Mausoleum, a historic site that serves as the final resting place of Vladimir Lenin.\"\n    }\n  }\n}<|eot_id|>",
      "clem_player": {
        "call_start": "2025-07-15 01:55:18.068805",
        "call_duration": "0:00:21.614328",
        "response": "{\n  \"Day 1\": {\n    \"Morning\": {\n      \"9:00 AM\": \"Start the day at Red Square, one of the most iconic landmarks in Moscow. Explore the colorful St. Basil's Cathedral and take a stroll around the square.\",\n      \"10:30 AM\": \"Visit the nearby Kremlin, a UNESCO World Heritage Site and the former residence of Russian tsars. Take a guided tour of the Armory Chamber and the Diamond Fund.\"\n    },\n    \"Afternoon\": {\n      \"1:00 PM\": \"Take a break for lunch at a traditional Russian restaurant, such as Cafe Pushkin or Stolovaya No. 57.\",\n      \"2:30 PM\": \"Visit the Tretyakov Gallery, one of the largest and most famous art museums in Russia. The gallery features a vast collection of Russian art, including works by Kandinsky, Chagall, and Malevich.\"\n    },\n    \"Evening\": {\n      \"7:00 PM\": \"Enjoy a traditional Russian dinner at a restaurant like Cafe Krasny Oktyabr or Zima.\",\n      \"9:00 PM\": \"Take a stroll along the Moskva River and enjoy the city's nightlife.\"\n    }\n  },\n  \"Day 2\": {\n    \"Morning\": {\n      \"9:00 AM\": \"Visit the Novodevichy Convent, a beautiful 16th-century monastery that served as a prison for Russian aristocrats during the Soviet era.\",\n      \"11:00 AM\": \"Explore the nearby Museum of Modern Art, which features a collection of contemporary Russian art.\"\n    },\n    \"Afternoon\": {\n      \"1:00 PM\": \"Take a break for lunch at a modern Russian restaurant, such as White Rabbit or 50 Let Pobedy.\",\n      \"2:30 PM\": \"Visit the Bolshoi Theatre, one of the most famous opera and ballet companies in the world. Take a guided tour of the theatre and learn about its history and architecture.\"\n    },\n    \"Evening\": {\n      \"7:00 PM\": \"Enjoy a performance at the Bolshoi Theatre, if schedules permit.\",\n      \"9:00 PM\": \"Take a walk through the trendy neighborhood of Taganka, known for its street art and nightlife.\"\n    }\n  },\n  \"Day 3\": {\n    \"Morning\": {\n      \"9:00 AM\": \"Visit the Gorky Park, a large public park that offers a variety of activities, including boat rides, cycling, and picnicking.\",\n      \"11:00 AM\": \"Explore the nearby Museum of Cosmonautics, which features a collection of space-related artifacts and exhibits.\"\n    },\n    \"Afternoon\": {\n      \"1:00 PM\": \"Take a break for lunch at a park cafe or food truck.\",\n      \"2:30 PM\": \"Visit the Sparrow Hills, a scenic area with stunning views of the city. Take a walk along the observation deck and enjoy the views.\"\n    },\n    \"Evening\": {\n      \"6:00 PM\": \"Return to Red Square for a farewell dinner at a traditional Russian restaurant.\",\n      \"8:00 PM\": \"End the trip with a visit to the nearby Lenin Mausoleum, a historic site that serves as the final resting place of Vladimir Lenin.\"\n    }\n  }\n}",
        "model_name": "llama3-8b"
      }
    }
  }
]